{
  "version": "1.0.0",
  "currency": "RUB",
  "startingBank": 100000,
  "totalDays": 30,
  "startingEnergy": 100,
  "goals": {
    "lowTicketMinimumRevenue": 300000,
    "priceBuckets": [
      { "maxPrice": 5000, "targetSales": 60 },
      { "maxPrice": 10000, "targetSales": 50 },
      { "maxPrice": 30000, "targetSales": 30 },
      { "maxPrice": 50000, "targetSales": 20 },
      { "maxPrice": 100000, "targetSales": 15 },
      { "maxPrice": 200000, "targetSales": 10 },
      { "maxPrice": null, "targetSales": 5 }
    ]
  },
  "productTypes": [
    { "id": "consultation", "enabled": true, "title": "Консультации", "capacity": 20, "recommendedSalesMethods": ["manual_chat", "call"] },
    { "id": "service", "enabled": true, "title": "Услуга", "capacity": 10, "recommendedSalesMethods": ["call"] },
    { "id": "recorded_course", "enabled": true, "title": "Обучение в записи", "capacity": null, "recommendedSalesMethods": ["bot_auto", "website_auto", "call"] },
    { "id": "live_course", "enabled": true, "title": "Живое обучение", "capacity": 30, "recommendedSalesMethods": ["webinar_direct", "call"] },
    { "id": "mentorship", "enabled": true, "title": "Наставничество", "capacity": 10, "recommendedSalesMethods": ["call"] },
    { "id": "membership", "enabled": true, "title": "Клуб/подписка", "capacity": null, "recommendedSalesMethods": ["bot_auto", "website_auto", "webinar_direct"] }
  ],
  "superpowers": [
    { "id": "expertise", "enabled": true, "title": "Экспертность" },
    { "id": "sales", "enabled": true, "title": "Продажи" },
    { "id": "marketing", "enabled": true, "title": "Маркетинг" },
    { "id": "energy", "enabled": true, "title": "Энергия" }
  ],
  "actions": [
    { "id": "friend_advice", "enabled": true, "category": "preparation", "title": "Совет друга/подруги", "cost": 0, "days": 1, "energyCost": 1, "requirements": [], "effects": [{ "operator": "setFlag", "path": "friendAdvice", "value": true }], "repeatPolicy": "never", "analyticsId": "friend_advice" },
    { "id": "smm_advice", "enabled": true, "category": "preparation", "title": "Совет знакомого SMM", "cost": 0, "days": 1, "energyCost": 1, "requirements": [], "effects": [{ "operator": "setFlag", "path": "smmAdvice", "value": true }], "repeatPolicy": "never", "analyticsId": "smm_advice" },
    { "id": "consultation_basic", "enabled": true, "category": "preparation", "title": "Базовая диагностика", "cost": 5000, "days": 1, "energyCost": 1, "requirements": [], "effects": [{ "operator": "setFlag", "path": "basicConsultation", "value": true }], "repeatPolicy": "upgrade", "analyticsId": "consultation_basic" },
    { "id": "consultation_detailed", "enabled": true, "category": "preparation", "title": "Подробная диагностика", "cost": 10000, "days": 1, "energyCost": 1, "requirements": [], "effects": [{ "operator": "setFlag", "path": "detailedConsultation", "value": true }], "repeatPolicy": "never", "analyticsId": "consultation_detailed" },
    { "id": "demand_poll", "enabled": true, "category": "preparation", "title": "Опросить аудиторию", "cost": 0, "days": 1, "energyCost": 5, "requirements": [], "effects": [{ "operator": "createAsset", "path": "demandConfidence", "value": 0.4 }], "repeatPolicy": "upgrade", "analyticsId": "demand_poll" },
    { "id": "demand_interviews", "enabled": true, "category": "preparation", "title": "Провести 10 диалогов", "cost": 0, "days": 2, "energyCost": 10, "requirements": [], "effects": [{ "operator": "createAsset", "path": "demandConfidence", "value": 0.7 }], "repeatPolicy": "upgrade", "analyticsId": "demand_interviews" },
    { "id": "demand_pilot_offer", "enabled": true, "category": "preparation", "title": "Предложить пилот", "cost": 0, "days": 2, "energyCost": 10, "requirements": [], "effects": [{ "operator": "createAsset", "path": "demandConfidence", "value": 1 }], "repeatPolicy": "never", "analyticsId": "demand_pilot_offer" },
    { "id": "product_pilot", "enabled": true, "category": "product", "title": "Быстрый пилот", "cost": 0, "days": 2, "energyCost": 10, "requirements": [], "effects": [{ "operator": "createAsset", "path": "pilotReady", "value": true }, { "operator": "createAsset", "path": "productQuality", "value": 0.95 }], "repeatPolicy": "never", "analyticsId": "product_pilot" },
    { "id": "product_self", "enabled": true, "category": "product", "title": "Собрать продукт самостоятельно", "cost": 0, "days": 3, "energyCost": 15, "requirements": [], "effects": [{ "operator": "createAsset", "path": "productQuality", "value": 1 }], "repeatPolicy": "never", "analyticsId": "product_self" },
    { "id": "product_home", "enabled": true, "category": "product", "title": "Оформить продукт дома", "cost": 5000, "days": 5, "energyCost": 20, "requirements": [], "effects": [{ "operator": "createAsset", "path": "productQuality", "value": 1.03 }], "repeatPolicy": "never", "analyticsId": "product_home" },
    { "id": "product_studio", "enabled": true, "category": "product", "title": "Студия, оператор и монтаж", "cost": 30000, "days": 7, "energyCost": 10, "requirements": [], "effects": [{ "operator": "createAsset", "path": "productQuality", "value": 1.05 }], "repeatPolicy": "never", "analyticsId": "product_studio" },
    { "id": "stories_3d", "enabled": true, "category": "content", "title": "Сторис 3 дня", "cost": 0, "days": 3, "energyCost": 8, "requirements": [], "effects": [], "repeatPolicy": "unlimited", "analyticsId": "stories_3d" },
    { "id": "reels_7d", "enabled": true, "category": "content", "title": "Рилсы 7 дней", "cost": 0, "days": 7, "energyCost": 15, "requirements": [], "effects": [], "repeatPolicy": "unlimited", "analyticsId": "reels_7d" },
    { "id": "reels_stories_7d", "enabled": true, "category": "content", "title": "Рилсы + сторис", "cost": 0, "days": 7, "energyCost": 22, "requirements": [], "effects": [], "repeatPolicy": "unlimited", "analyticsId": "reels_stories_7d" },
    { "id": "live_stream", "enabled": true, "category": "content", "title": "Прямой эфир", "cost": 0, "days": 2, "energyCost": 12, "requirements": [], "effects": [], "repeatPolicy": "unlimited", "analyticsId": "live_stream" },
    { "id": "webinar", "enabled": true, "category": "content", "title": "Вебинар", "cost": 5000, "days": 5, "energyCost": 18, "requirements": [], "effects": [], "repeatPolicy": "unlimited", "analyticsId": "webinar" },
    { "id": "telegram_warmup", "enabled": true, "category": "content", "title": "Telegram-прогрев", "cost": 0, "days": 5, "energyCost": 10, "requirements": [{ "operator": "neq", "path": "player.telegramStatus", "value": "none" }], "effects": [], "repeatPolicy": "unlimited", "analyticsId": "telegram_warmup" },
    { "id": "guide_self", "enabled": true, "category": "route", "title": "Гайд самостоятельно", "cost": 0, "days": 2, "energyCost": 8, "requirements": [], "effects": [{ "operator": "createAsset", "path": "guide", "value": "self" }], "repeatPolicy": "never", "analyticsId": "guide_self" },
    { "id": "guide_specialist", "enabled": true, "category": "route", "title": "Гайд со специалистом", "cost": 5000, "days": 1, "energyCost": 3, "requirements": [], "effects": [{ "operator": "createAsset", "path": "guide", "value": "specialist" }], "repeatPolicy": "never", "analyticsId": "guide_specialist" },
    { "id": "video_self", "enabled": true, "category": "route", "title": "Видеоурок самостоятельно", "cost": 5000, "days": 4, "energyCost": 12, "requirements": [], "effects": [{ "operator": "createAsset", "path": "videoLesson", "value": "self" }], "repeatPolicy": "never", "analyticsId": "video_self" },
    { "id": "video_specialist", "enabled": true, "category": "route", "title": "Видеоурок со специалистом", "cost": 15000, "days": 2, "energyCost": 5, "requirements": [], "effects": [{ "operator": "createAsset", "path": "videoLesson", "value": "specialist" }], "repeatPolicy": "never", "analyticsId": "video_specialist" },
    { "id": "simple_bot_self", "enabled": true, "category": "route", "title": "Простой бот самостоятельно", "cost": 0, "days": 5, "energyCost": 15, "requirements": [], "effects": [{ "operator": "createAsset", "path": "simpleBot", "value": "self" }], "repeatPolicy": "never", "analyticsId": "simple_bot_self" },
    { "id": "simple_bot_specialist", "enabled": true, "category": "route", "title": "Простой бот со специалистом", "cost": 10000, "days": 2, "energyCost": 5, "requirements": [], "effects": [{ "operator": "createAsset", "path": "simpleBot", "value": "specialist" }], "repeatPolicy": "never", "analyticsId": "simple_bot_specialist" },
    { "id": "ai_bot_self", "enabled": true, "category": "route", "title": "ИИ-бот самостоятельно", "cost": 0, "days": 7, "energyCost": 18, "requirements": [], "effects": [{ "operator": "createAsset", "path": "aiBot", "value": "self" }], "repeatPolicy": "never", "analyticsId": "ai_bot_self" },
    { "id": "ai_bot_specialist", "enabled": true, "category": "route", "title": "ИИ-бот со специалистом", "cost": 25000, "days": 3, "energyCost": 5, "requirements": [], "effects": [{ "operator": "createAsset", "path": "aiBot", "value": "specialist" }], "repeatPolicy": "never", "analyticsId": "ai_bot_specialist" },
    { "id": "website_basic", "enabled": true, "category": "route", "title": "Обычный сайт", "cost": 20000, "days": 3, "energyCost": 3, "requirements": [], "effects": [{ "operator": "createAsset", "path": "website", "value": "basic" }], "repeatPolicy": "never", "analyticsId": "website_basic" },
    { "id": "website_beautiful", "enabled": true, "category": "route", "title": "Красивый сайт", "cost": 50000, "days": 7, "energyCost": 3, "requirements": [], "effects": [{ "operator": "createAsset", "path": "website", "value": "beautiful" }], "repeatPolicy": "never", "analyticsId": "website_beautiful" },
    { "id": "manual_chat", "enabled": true, "category": "sales", "title": "Продать в переписке", "cost": 0, "days": 0, "energyCost": 0.3, "requirements": [], "effects": [], "repeatPolicy": "unlimited", "analyticsId": "manual_chat" },